,source,author,title,description,url,urlToImage,publishedAt,content
0,"{'id': 'wired', 'name': 'Wired'}",Gilad Edelman,The Analogy Between Covid-19 and Climate Change Is Eerily Precise,"First deny the problem, then say the solution is too expensive? The playbook here is all too familiar.",https://www.wired.com/story/the-analogy-between-covid-19-and-climate-change-is-eerily-precise/,"https://media.wired.com/photos/5e7ba5188283f9000a41518c/191:100/w_1280,c_limit/Ideas-COVID-Climat-1207216812.jpg",2020-03-25T18:59:54Z,"For a brief moment there, it looked as though the coronavirus pandemic might escape the muck of partisanship. 
Its true that Donald Trump, wary of a recession during a reelection year, had first tried to talk the virus into submission. His counterfactual ins… [+4389 chars]"
1,"{'id': 'the-verge', 'name': 'The Verge'}",Russell Brandom,"Relaxing isolation rules won’t help the economy, say economists","President Donald Trump has pushed to relax social distancing and shelter-in-place rules by Easter Sunday, April 12th, but economists say relaxing restrictions could make the economic damage even worse.",https://www.theverge.com/2020/3/25/21193670/trump-easter-coronavirus-isolation-relax-rules-economy-social-distancing,https://cdn.vox-cdn.com/thumbor/0Tupek3aPuU95Pc9H1cFIcxpoAk=/0x316:4416x2628/fit-in/1200x630/cdn.vox-cdn.com/uploads/chorus_asset/file/19831887/1213734411.jpg.jpg,2020-03-25T12:36:51Z,"President Trump is pushing to ease restrictions by Easter, but it would only make the pandemic worse
Photo by Spencer Platt/Getty Images
As the COVID-19 pandemic stretches into its second month and shows no signs of slowing, President Donald Trump has pushe… [+5345 chars]"
2,"{'id': 'techcrunch', 'name': 'TechCrunch'}",Natasha Lomas,TripActions reportedly lays off hundreds amid COVID-19 travel freeze,"The coronavirus demand crunch has taken another bite: Palo Alto-based corporate travel-focused unicorn, TripActions, reportedly laid off hundreds of staff yesterday. Per this post on Blind — written by someone with a verified TripActions email address — the c…",http://techcrunch.com/2020/03/25/tripactions-reportedly-lays-off-hundreds-amid-covid-19-travel-freeze/,https://techcrunch.com/wp-content/uploads/2020/01/GettyImages-1124943739.jpg?w=599,2020-03-25T11:10:36Z,"The coronavirus demand crunch has taken another bite: Palo Alto-based corporate travel-focused unicorn, TripActions, reportedly laid off hundreds of staff yesterday.
Per this post on Blind — written by someone with a verified TripActions email address — the … [+2533 chars]"
3,"{'id': None, 'name': 'Gizmodo.com'}","Brian Kahn and Dhruv Mehrotra on Earther, shared by Andrew Couts to Gizmodo",Coronavirus Has Slashed Global Air Pollution. This Interactive Map Shows How.,"The covid-19 pandemic has changed the world, grinding to a halt increasingly large geographic areas and portions of the economy in an effort to slow the virus’ spread. Read more...",https://earther.gizmodo.com/coronavirus-slashes-global-air-pollution-interactive-m-1842473790,"https://i.kinja-img.com/gawker-media/image/upload/c_fill,f_auto,fl_progressive,g_center,h_675,pg_1,q_80,w_1200/rl7nofk1srwrrbcuf4ti.png",2020-03-25T12:53:00Z,"The covid-19 pandemic has changed the world, grinding to a halt increasingly large geographic areas and portions of the economy in an effort to slow the virus spread.
The impacts have been profound on the ground, but government-mandated lockdowns have also r… [+6988 chars]"
4,"{'id': None, 'name': 'Gizmodo.com'}",Tom McKay,Twitter Deletes Post by The Federalist Calling for Coronavirus Infection Program,Twitter has removed a tweet from the right-wing site the Federalist after it shared an article by an unlicensed dermatologist urging the public to be exposed to the novel coronavirus en masse and the social network temporarily locked the site’s account. Read …,https://gizmodo.com/twitter-deletes-post-by-the-federalist-calling-for-coro-1842496663,"https://i.kinja-img.com/gawker-media/image/upload/c_fill,f_auto,fl_progressive,g_center,h_675,pg_1,q_80,w_1200/dldavotjvcornz36ijae.png",2020-03-25T23:15:00Z,"Twitter has removed a tweet from the right-wing site the Federalist after it shared an article by an unlicensed dermatologist urging the public to be exposed to the novel coronavirus en masse and the social network temporarily locked the sites account.
For t… [+5811 chars]"
5,"{'id': None, 'name': 'Gizmodo.com'}",Ed Cara,The Truth of Coronavirus Might Be Worse Than the Conspiracy Theories,"The covid-19 pandemic is a disorienting, fast-moving, dangerous crisis that has basically everyone in the world in its grips. As is so often the case in times of disaster, people, including political leaders, are promoting conspiracy theories about the origin…",https://gizmodo.com/the-truth-of-coronavirus-might-be-worse-than-the-conspi-1842492005,"https://i.kinja-img.com/gawker-media/image/upload/c_fill,f_auto,fl_progressive,g_center,h_675,pg_1,q_80,w_1200/heuzkcj5g2en8eeor2tp.jpg",2020-03-25T22:25:00Z,"The covid-19 pandemic is a disorienting, fast-moving, dangerous crisis that has basically everyone in the world in its grips. As is so often the case in times of disaster, people, including political leaders, are promoting conspiracy theories about the origin… [+4864 chars]"
6,"{'id': None, 'name': 'Gizmodo.com'}","Yessenia Funes on Earther, shared by Brian Kahn to Gizmodo",'I’m Just Praying': Miners Fear the Impacts Covid-19 Could Have in Coal Country,"Jimmy Moore barely leaves the house. When he does, the 74-year-old is usually parked outside his local pharmacy in Dorton, Kentucky, until someone brings out his regular meds. As soon as Moore arrives home, he changes his clothes and washes his hands. Religio…",https://earther.gizmodo.com/i-m-just-praying-miners-fear-the-impacts-covid-19-coul-1842488514,"https://i.kinja-img.com/gawker-media/image/upload/c_fill,f_auto,fl_progressive,g_center,h_675,pg_1,q_80,w_1200/k4u1gwbweociyppgfrty.jpg",2020-03-25T04:02:00Z,"Jimmy Moore barely leaves the house. When he does, the 74-year-old is usually parked outside his local pharmacy in Dorton, Kentucky, until someone brings out his regular meds. As soon as Moore arrives home, he changes his clothes and washes his hands. Religio… [+7361 chars]"
7,"{'id': 'mashable', 'name': 'Mashable'}",Sasha Lekach,"Coronavirus outbreak means gig workers from Uber, Lyft barely get paid","As ride requests shrivel up and shared rides are pulled from the Uber and Lyft apps, drivers are feeling the economic impact of COVID-19, the official term for the disease spreading in the new coronavirus outbreak. With most of the U.S. ordered to shelter in …",https://mashable.com/article/uber-lyft-coronavirus-employment/,https://mondrian.mashable.com/2020%252F03%252F25%252F30%252F3535bc37b29149748b2f32f30a7b9109.59cde.jpg%252F1200x630.jpg?signature=LFzHF6Po30PsA2absSeBNlXwDSU=,2020-03-25T15:57:23Z,"As ride requests shrivel up and shared rides are pulled from the Uber and Lyft apps, drivers are feeling the economic impact of COVID-19, the official term for the disease spreading in the new coronavirus outbreak. With most of the U.S. ordered to shelter in … [+4240 chars]"
8,"{'id': 'cnn', 'name': 'CNN'}",,Nurse's emotional plea: Don't sacrifice lives of elderly for the economy,Washington state nurse Karen Goheen's family was impacted by the coronavirus pandemic when both she and her parents tested positive for the virus.,https://www.cnn.com/videos/health/2020/03/25/washington-nurse-karen-goheen-coronavirus-parents-intv-cpt-vpx.cnn,https://cdn.cnn.com/cnnnext/dam/assets/200325000412-washington-nurse-cpt-intv-super-tease.jpg,2020-03-25T04:11:01Z,Chat with us in Facebook Messenger. Find out what's happening in the world as it unfolds.
9,"{'id': 'cnn', 'name': 'CNN'}",By CNN Business,US stock futures rise after Congress reaches stimulus bill deal,"The stock market's roller coaster week continues as investors continue to worry about the coronavirus outbreak. Here are the latest updates on the Dow, S&P 500, companies and more.",https://www.cnn.com/business/live-news/stock-market-news-today-032520/index.html,https://cdn.cnn.com/cnnnext/dam/assets/200323101800-nyse-0321-super-tease.jpg,2020-03-25T10:37:08Z,"US stock futures rose Wednesday as political leaders in the country reached a major deal overnight about a $2-trillion stimulus bill that will provide a jolt to America's coronavirus-striken economy. 
The full details have yet to be released. But over the la… [+586 chars]"
10,"{'id': 'ars-technica', 'name': 'Ars Technica'}",John Timmer,Coronavirus: Is it too much to ask for an actual plan?,Editorial: We need someone who can explain how we'll deal with the pandemic.,https://arstechnica.com/science/2020/03/coronavirus-is-it-too-much-to-ask-for-an-actual-plan/,https://cdn.arstechnica.net/wp-content/uploads/2020/03/GettyImages-1208074075-760x380.jpg,2020-03-25T22:17:34Z,"Enlarge/ To call the government's response to the pandemic unsteady would be an understatement.
2 with 2 posters participating
In difficult and frightening times, it's normal for a certain amount of confusion and misinformation to spread. The existence of s… [+10505 chars]"
11,"{'id': 'reuters', 'name': 'Reuters'}",Davide Barbuscia,Iran has limited scope for coronavirus economic stimulus,"Shut out of international capital markets and facing a further hit to its finances with the collapse in oil prices coming on top of U.S. sanctions, Iran is struggling to shield its economy from the coronavirus pandemic.",https://www.reuters.com/article/us-health-coronavirus-iran-economy-analy-idUSKBN21C2L7,https://s2.reutersmedia.net/resources/r/?m=02&d=20200325&t=2&i=1508069259&w=1200&r=LYNXMPEG2O1SI,2020-03-25T16:04:00Z,"DUBAI (Reuters) - Shut out of international capital markets and facing a further hit to its finances with the collapse in oil prices coming on top of U.S. sanctions, Iran is struggling to shield its economy from the coronavirus pandemic. 
While Iran has the … [+4199 chars]"
12,"{'id': 'reuters', 'name': 'Reuters'}",Jason Lange,"After being courted by Trump, African Americans, Latinos face economic blow from coronavirus","The financial hardship caused by the coronavirus outbreak could fall particularly hard on African Americans and Latinos, undoing economic gains President Donald Trump has touted in his outreach to those key voting blocs ahead of the Nov. 3 election.",https://www.reuters.com/article/us-health-coronavirus-trump-minorities-idUSKBN21C1E7,https://s2.reutersmedia.net/resources/r/?m=02&d=20200325&t=2&i=1507950282&w=1200&r=LYNXMPEG2O0Y3,2020-03-25T10:20:02Z,"WASHINGTON (Reuters) - The financial hardship caused by the coronavirus outbreak could fall particularly hard on African Americans and Latinos, undoing economic gains President Donald Trump has touted in his outreach to those key voting blocs ahead of the Nov… [+4457 chars]"
13,"{'id': 'reuters', 'name': 'Reuters'}",Trevor Hunnicutt,Biden calls Trump's Easter back-to-business goal 'catastrophic',"Democratic presidential candidate Joe Biden said on Wednesday that potential efforts by President Donald Trump to re-open American businesses in time for the Easter holiday could be ""catastrophic.""",https://www.reuters.com/article/us-usa-election-biden-idUSKBN21C3B2,https://s4.reutersmedia.net/resources/r/?m=02&d=20200325&t=2&i=1508145548&w=1200&r=LYNXMPEG2O29W,2020-03-25T20:05:51Z,"(Reuters) - Democratic presidential candidate Joe Biden said on Wednesday that potential efforts by President Donald Trump to re-open American businesses in time for the Easter holiday could be “catastrophic.” 
The governors of at least 18 states, including … [+1923 chars]"
14,"{'id': 'reuters', 'name': 'Reuters'}",Reuters Editorial,U.S. stocks seesaw as vote awaited on stimulus deal,"U.S stocks seesawed on Wednesday, digesting the previous session's huge rebound, with investors torn as optimism about an imminent $2 trillion coronavirus package was offset by concerned about the lasting economic impact from the pandemic. [.N]",https://www.reuters.com/article/us-usa-markets-analystview-idUSKBN21C2JS,https://s3.reutersmedia.net/resources/r/?m=02&d=20200325&t=2&i=1508060496&w=1200&r=LYNXMPEG2O1RN,2020-03-25T15:33:44Z,"NEW YORK (Reuters) - U.S stocks seesawed on Wednesday, digesting the previous session’s huge rebound, with investors torn as optimism about an imminent $2 trillion coronavirus package was offset by concerned about the lasting economic impact from the pandemic… [+4378 chars]"
15,"{'id': 'reuters', 'name': 'Reuters'}",Reuters Editorial,Instant View: U.S. government agrees stimulus package in response to coronavirus pandemic,"U.S. senators and officials in U.S. President Donald Trump's administration have reached an agreement on a massive economic stimulus bill to alleviate the economic impact of the coronavirus outbreak, White House official Eric Ueland said early on Wednesday.",https://www.reuters.com/article/us-health-coronavirus-usa-stimulus-insta-idUSKBN21C0L8,https://s4.reutersmedia.net/resources_v2/images/rcom-default.png,2020-03-25T05:46:55Z,"TOKYO (Reuters) - U.S. senators and officials in U.S. President Donald Trump’s administration have reached an agreement on a massive economic stimulus bill to alleviate the economic impact of the coronavirus outbreak, White House official Eric Ueland said ear… [+2110 chars]"
16,"{'id': 'reuters', 'name': 'Reuters'}",Richard Cowan,"U.S. senators look to quickly pass massive coronavirus bill, head home","U.S. senators will vote on Wednesday on a $2-trillion bipartisan package of legislation to alleviate the devastating economic impact of the coronavirus pandemic, hoping it will become law quickly so they can get out of Washington.",https://www.reuters.com/article/us-health-coronavirus-usa-congress-idUSKBN21C1C0,https://s2.reutersmedia.net/resources/r/?m=02&d=20200325&t=2&i=1507945169&w=1200&r=LYNXMPEG2O0X3,2020-03-25T10:05:26Z,"WASHINGTON (Reuters) - U.S. senators will vote on Wednesday on a $2-trillion bipartisan package of legislation to alleviate the devastating economic impact of the coronavirus pandemic, hoping it will become law quickly so they can get out of Washington. 
Top… [+3424 chars]"
17,"{'id': 'reuters', 'name': 'Reuters'}",Corina Pons,"Exclusive: Venezuela in talks with China over support amid pandemic, oil price drop - sources","Venezuela has opened talks with China over possible financial support to cope with a sharp drop in oil prices and the arrival of the novel coronavirus, four sources familiar with the negotiations said.",https://www.reuters.com/article/us-health-coronavirus-venezuela-china-ex-idUSKBN21C2LB,https://s3.reutersmedia.net/resources/r/?m=02&d=20200325&t=2&i=1508072324&w=1200&r=LYNXMPEG2O1SN,2020-03-25T16:13:04Z,"CARACAS (Reuters) - Venezuela has opened talks with China over possible financial support to cope with a sharp drop in oil prices and the arrival of the novel coronavirus, four sources familiar with the negotiations said. 
The government of President Nicolas… [+3530 chars]"
18,"{'id': 'reuters', 'name': 'Reuters'}",Mari Saito,"In Japan, hotels lose out on Olympic bet as coronavirus spreads",The Osaka Corona Hotel in western Japan has been eerily quiet and empty the past few weeks.,https://www.reuters.com/article/us-health-coronavirus-japan-economy-insi-idUSKBN21C0BI,https://s4.reutersmedia.net/resources/r/?m=02&d=20200325&t=2&i=1507808078&w=1200&r=LYNXMPEG2O07Y,2020-03-25T03:04:54Z,"OSAKA (Reuters) - The Osaka Corona Hotel in western Japan has been eerily quiet and empty the past few weeks. 
“Our name is extremely regrettable,” Kohei Fujii, the hotel’s sales director, said with a sigh as he sat in an empty cafe in the lobby. A sign adve… [+6867 chars]"
19,"{'id': 'reuters', 'name': 'Reuters'}",Jack Tarrant,Stop the clock: Japan awakes to reality of Tokyo Games postponement,Japan awoke on Wednesday to the deflating reality that the Olympics they had hoped to host in Tokyo this summer were now probably 16 months away after the coronavirus crisis forced organizers into an unprecedented postponement.,https://www.reuters.com/article/us-health-coronavirus-olympics-idUSKBN21C0G8,https://s1.reutersmedia.net/resources/r/?m=02&d=20200325&t=2&i=1507834612&w=1200&r=LYNXMPEG2O0D0,2020-03-25T04:28:33Z,"TOKYO (Reuters) - Japan awoke on Wednesday to the deflating reality that the Olympics they had hoped to host in Tokyo this summer were now probably 16 months away after the coronavirus crisis forced organizers into an unprecedented postponement. 
The Interna… [+4991 chars]"
20,"{'id': 'reuters', 'name': 'Reuters'}",Matt Spetalnick,Trump risks blowback from war of words with China over coronavirus,"U.S. President Donald Trump and some top aides have repeatedly excoriated China over its handling of the coronavirus pandemic, a stance that even some in his administration worry could bring a dangerous backlash from Beijing.",https://www.reuters.com/article/us-health-coronavirus-usa-china-idUSKBN21C3KS,https://s1.reutersmedia.net/resources/r/?m=02&d=20200325&t=2&i=1508181898&w=1200&r=LYNXMPEG2O2J0,2020-03-25T21:43:27Z,"WASHINGTON (Reuters) - U.S. President Donald Trump and some top aides have repeatedly excoriated China over its handling of the coronavirus pandemic, a stance that even some in his administration worry could bring a dangerous backlash from Beijing. 
While Tr… [+4794 chars]"
21,"{'id': 'reuters', 'name': 'Reuters'}",Marisa Taylor,Exclusive: U.S. slashed CDC staff inside China prior to coronavirus outbreak,"The Trump administration cut staff by more than two-thirds at a key U.S. public health agency operating inside China, as part of a larger rollback of U.S.-funded health and science experts on the ground there leading up to the coronavirus outbreak, Reuters ha…",https://www.reuters.com/article/us-health-coronavirus-china-cdc-exclusiv-idUSKBN21C3N5,https://s3.reutersmedia.net/resources/r/?m=02&d=20200325&t=2&i=1508195526&w=1200&r=LYNXMPEG2O2L7,2020-03-25T22:26:01Z,"WASHINGTON(Reuters) - The Trump administration cut staff by more than two-thirds at a key U.S. public health agency operating inside China, as part of a larger rollback of U.S.-funded health and science experts on the ground there leading up to the coronaviru… [+9559 chars]"
22,"{'id': None, 'name': 'Androidcentral.com'}",Stephen Warwick,"UK government to sell coronavirus testing kits on Amazon ""within days""","It could be a ""total game-changer."" What you need to know The UK government may start selling coronavirus testing kits on Amazon within days. That's according to Professor Sharon Peacock, director of the National Infection Service at Public Health England. It…",https://www.androidcentral.com/uk-government-sell-coronavirus-testing-kits-amazon,https://www.androidcentral.com/sites/androidcentral.com/files/styles/large/public/field/image/2020/03/covid-test-2a0y.jpg?itok=pV4Q0lkf,2020-03-25T16:56:46Z,"The UK government may start selling coronavirus testing kits on Amazon ""within days"".
According to Sky News:
Millions of new coronavirus testing kits could be ready to order on Amazon in days, rather than weeks or months, according to Public Health England.… [+1257 chars]"
23,"{'id': None, 'name': 'Cnet.com'}",Richard Trenholm,Vivarium is the perfect horror movie for coronavirus self-isolation - CNET,"Director Lorcan Finnegan reveals how his surreal and striking new Jesse Eisenberg movie, online March 27, recovered from COVID-19 cancelation.",https://www.cnet.com/news/vivarium-jesse-eisenberg-is-the-perfect-horror-movie-for-coronavirus-self-isolation/,https://cnet4.cbsistatic.com/img/vl-cnBEemPsjQteZtv-sKgywkzA=/2020/03/25/e0e791c8-7d4f-4d21-88ae-179b3add7d3e/vivarium-jesse-eisenberg-movie-27-march-014.jpg,2020-03-25T22:57:00Z,"Jesse Eisenberg and Imogen Poots star in Vivarium.
Vivarium
When Lorcan Finnegan wanted to make a horror movie that tackled modern fears, he made Vivarium: a film about a couple unable to leave their house.
""Yeah, it's weird,"" laughs the Irish director, wh… [+3882 chars]"
24,"{'id': 'business-insider', 'name': 'Business Insider'}","bwinck@businessinsider.com (Ben Winck), Ben Winck",Dow soars 496 points as traders await official approval for $2 trillion coronavirus stimulus deal,"Getty Images / Drew Angerer US stocks climbed on Wednesday as the Senate moved toward a final vote on a $2 trillion relief package to aid economic fallout from coronavirius. The White House and the Senate reached an agreement overnight on the package, but a f…",https://www.businessinsider.com/stock-market-news-today-indext-reaction-coronavirus-bill-voting-2020-3,https://images.markets.businessinsider.com/image/5d4075c9a209d36dd20f8999-2000/gettyimages-1073256452.jpg,2020-03-25T20:07:37Z,"Getty Images / Drew Angerer
<ul><li>US stocks climbed on Wednesday as the Senate moved toward a final vote on a $2 trillion relief package to aid economic fallout from coronavirius.</li><li>The White House and the Senate reached an agreement overnight on the… [+3237 chars]"
25,"{'id': 'business-insider', 'name': 'Business Insider'}","feedback@businessinsider.com (John Haltiwanger), John Haltiwanger","The WHO said social distancing is 'buying time,' but it must be paired with widespread testing to stop coronavirus","Reuters The WHO said countries need more testing for coronavirus to contain it. The US has struggled to deliver on this and finds itself in a growing crisis. World Health Organization (WHO) Director-General Tedros Adhanom Ghebreyesus on Wednesday, March 25, s…",https://www.businessinsider.com/who-social-distancing-buying-time-must-pair-with-more-testing-2020-3,https://i.insider.com/5e6fb156c485404f1c742a75?width=1200&format=jpeg,2020-03-25T20:50:42Z,"World Health Organization (WHO) Director-General Tedros Adhanom Ghebreyesus on Wednesday, March 25, said actions such as social distancing are ""buying time,"" but cautioned they need to be paired with widespread testing for countries to get the coronavirus pan… [+3790 chars]"
26,"{'id': None, 'name': 'Theconversation.com'}",The Conversation,Coronavirus is revealing a major flaw in the systems we rely on to get food,"AP Images / LM Otero Quickly following on the heels of fears about the coronavirus were empty shelves on grocery stories, as panicked shoppers stocked up on toilet paper, hand sanitizer, and other items. Those shelves have been restocked, but the speed with w…",https://theconversation.com/coronavirus-the-perils-of-our-just-enough-just-in-time-food-system-133724,https://i.insider.com/5e7a91402d41c13c7e02ba02?width=1200&format=jpeg,2020-03-25T13:05:36Z,"Toilet paper shortages, profiteering from hand sanitizer and empty shelves in grocery stores.
Thanks to COVID-19, governments in most industrialized nations are preparing for shortages of life's necessities. If they fail, riots over food may be inevitable. S… [+4802 chars]"
27,"{'id': None, 'name': 'Npr.org'}",Joanna Kakissis,Netherlands' Huge Flower Sector Wilts As Coronavirus Hurts Business,The Dutch market is a global blossom powerhouse but sales are withering as virus-hit countries hunker down.,https://www.npr.org/2020/03/25/820239298/netherlands-huge-flower-sector-wilts-as-coronavirus-hurts-business,https://media.npr.org/assets/img/2020/03/24/gettyimages-1207295424_wide-e17657712c8fa21e80d96f89812a7e02e69d6779.jpg?s=1400,2020-03-25T13:34:44Z,"Flowers are being destroyed at the flower auction in Aalsmeer, Netherlands, on March 16, 2020. The Dutch horticultural sector is sounding the alarm about the effects of the coronavirus crisis. Due to the loss of demand, the auctions are struggling with low pr… [+3579 chars]"
28,"{'id': None, 'name': 'Slashdot.org'}",msmash,'Don't Bail Out the Cruise Industry',"An anonymous reader shares a column: The United States economy is grinding to a halt as the country grapples with the novel coronavirus pandemic, and one of the first major actions President Trump has floated is having the government bail out the cruise line …",https://news.slashdot.org/story/20/03/25/1715215/dont-bail-out-the-cruise-industry,https://a.fsdn.com/sd/topics/business_64.png,2020-03-25T20:45:00Z,"The United States economy is grinding to a halt as the country grapples with the novel coronavirus pandemic, and one of the first major actions President Trump has floated is having the government bail out the cruise line industry, which he says is a ""prime c… [+1075 chars]"
29,"{'id': 'business-insider', 'name': 'Business Insider'}",John Haltiwanger,"Republicans trust Trump more than the CDC for accurate info on the coronavirus, a new poll shows","President Donald Trump is trusted more among Republicans (90%) for accurate info on the coronavirus pandemic than the CDC (84%), a new CBS News/YouGov poll found. Overall, a majority of Americans (56%) said they don't trust Trump for accurate information on c…",https://www.businessinsider.com/republicans-trust-trump-more-than-cdc-coronavirus-new-poll-shows-2020-3,https://i.insider.com/5e7b694e2d41c16f80504a90?width=1200&format=jpeg,2020-03-25T14:43:47Z,"Republicans trust President Donald Trump for accurate info on the coronavirus pandemic more than the nation's leading public health agency, according to a CBS News/YouGov poll released on Tuesday. 
Americans were asked: Who do you trust and not trust to give… [+2646 chars]"
