,source,author,title,description,url,urlToImage,publishedAt,content
482,"{'id': 'the-times-of-india', 'name': 'The Times of India'}",NYT News Service,Don't let small businesses die,Don't let small businesses dieIt is not only businesses that face economic distress. A sad fact of the economy in recent decades has been that far too many people have been relegated to economic positions that are even less secure than a small business.,https://economictimes.indiatimes.com/small-biz/sme-sector/we-all-need-small-businesses-dont-let-them-die/articleshow/74743434.cms,"https://img.etimg.com/thumb/msid-74743717,width-1070,height-580,imgsize-195001,overlay-etrise/photo.jpg",2020-03-21T06:27:37Z,"By Sendhil MullainathanBy the time the coronavirus crisis is over, we might emerge from our homes only to find some of our favorite shops, gyms and restaurants permanently shuttered.
It doesn’t need to be that way. While some of the harm has already been don… [+6300 chars]"
483,"{'id': 'the-times-of-india', 'name': 'The Times of India'}",Reuters,"Panic buying, lockdowns during this pandemic may drive world food inflation","With over 270,000 infections and more than 11,000 deaths, the epidemic has stunned the world and drawn comparisons with periods such as World War Two and the 1918 Spanish flu pandemic.",https://economictimes.indiatimes.com/news/economy/indicators/panic-buying-lockdowns-during-this-pandemic-may-drive-world-food-inflation/articleshow/74742932.cms,"https://img.etimg.com/thumb/msid-74743027,width-1070,height-580,imgsize-901238,overlay-economictimes/photo.jpg",2020-03-21T05:35:29Z,"SINGAPORE: Lockdowns and panic food buying due to the coronavirus pandemic could ignite world food inflation even though there are ample supplies of staple grains and oilseeds in key exporting nations, a senior economist at FAO and agricultural analysts said.… [+3397 chars]"
484,"{'id': 'reuters', 'name': 'Reuters'}",Naveen Thukral,"Panic buying, lockdowns may drive world food inflation: FAO, analysts","Lockdowns and panic food buying due to the coronavirus pandemic could ignite world food inflation even though there are ample supplies of staple grains and oilseeds in key exporting nations, a senior economist at FAO and agricultural analysts said.",https://www.reuters.com/article/us-health-coronavirus-food-security-idUSKBN21808G,https://s4.reutersmedia.net/resources/r/?m=02&d=20200321&t=2&i=1506161220&w=1200&r=LYNXMPEG2K06R,2020-03-21T05:23:23Z,"SINGAPORE (Reuters) - Lockdowns and panic food buying due to the coronavirus pandemic could ignite world food inflation even though there are ample supplies of staple grains and oilseeds in key exporting nations, a senior economist at FAO and agricultural ana… [+3663 chars]"
485,"{'id': None, 'name': 'Nakedcapitalism.com'}",Yves Smith,Links 3/21/2020,"Our popular links: natural Venice, melting Greenland, drone dog walk, US bad track, NY ""pause,"" citizen mask prep, chloroquinine debate, hospitals deluged, Dems cheap on coronavirus rescue, coronavirus censorship, Trump union-busting, Sanders, Tesla, Goldman …",https://www.nakedcapitalism.com/2020/03/links-3-21-2020.html,https://www.nakedcapitalism.com/wp-content/uploads/2020/03/00-sparkler-links.jpg,2020-03-21T10:55:47Z,"‘Nature is taking back Venice’: wildlife returns to tourist-free city Guardian (furzy)
Geologists find a lost fragment of an ancient continent filled with diamonds that formed part of Earth’s continental crust 2.7 billion years ago in Canada’s North Atlantic… [+7058 chars]"
486,"{'id': None, 'name': 'Psychologytoday.com'}","Tara Thiagarajan Ph.D., and Jennifer J. Newson Ph.D.",The Coronavirus-Unemployment Trade-off,"As more people lose their jobs due to the Coronavirus Pandemic, what level of health risk is worth prolonged unemployment?",https://www.psychologytoday.com/ca/blog/7-billion-brains/202003/the-coronavirus-unemployment-trade,https://cdn.psychologytoday.com/sites/default/files/styles/image-article_inline_full/public/field_blog_entry_teaser_image/2020-03/istock-1211061790.jpg?itok=zoCk0yVU,2020-03-21T17:22:41Z,"For all of known history humans have risked their lives for resources and economic means.   For centuries people took jobs as sailors, working aboard ships that had a 1 in 4 chance of capsizing and taking their lives with it.  Many have made dangerous journey… [+2978 chars]"
487,"{'id': 'cbc-news', 'name': 'CBC News'}",Nahlah Ayed,The week panic hit the West,"The war metaphors invoked by leaders from the U.K. to France and beyond in the battle against the coronavirus seemed almost inevitable, but they are of limited usefulness when the virus is an unseen enemy that has managed to strike at the heart of democratic …",https://www.cbc.ca/news/world/ideas-nahlah-ayed-coronavirus-western-leaders-1.5503672,https://i.cbc.ca/1.5503914.1584661954!/fileImage/httpImage/image.JPG_gen/derivatives/16x9_620/health-coronavirus-france-lockdown.JPG,2020-03-21T08:00:58Z,"Only a few panicked days stand between Donald Trump, the self-declared ""wartime president,"" and Donald Trump, the pre-pandemic president who saw concern over the fast-spreading virus as the latest political ""hoax.""
Critics are certain that the U.S. president… [+8470 chars]"
488,"{'id': None, 'name': 'Forbes.com'}","James Asquith, Contributor, James Asquith, Contributor https://www.forbes.com/sites/jamesasquith/",No New Coronavirus Local Cases—China Is Reopening Its Tourist Attractions,No new coronavirus local cases were reported in China yesterday. The country that was previously worst hit by cover-19 (now it is Italy) has closed the last coronavirus temporary hospital and opened man attractions including Shanghai Disneyland. Wuhan is also…,https://www.forbes.com/sites/jamesasquith/2020/03/21/no-new-coronavirus-local-cases-china-is-reopening-its-tourist-attractions/,https://thumbor.forbes.com/thumbor/fit-in/1200x0/filters%3Aformat%28jpg%29/https%3A%2F%2Fspecials-images.forbesimg.com%2Fimageserve%2F1206357296%2F0x0.jpg%3FcropX1%3D0%26cropX2%3D6048%26cropY1%3D124%26cropY2%3D3525,2020-03-21T12:42:24Z,"In more positive news for those locked down in self-isolation around the world, life in China is continuing to return to normal.
Tourist attractions and stores are reopening on the mainland that was hardest hit by the outbreak of the novel coronavirus.
A wo… [+3883 chars]"
489,"{'id': None, 'name': 'Forbes.com'}","Jon Younger, Contributor, Jon Younger, Contributor https://www.forbes.com/sites/jonyounger/","Pew Research Describes How Freelancers, Gigsters And Others See The Coronavirus Threat","Pew research describes how freelancers, gigsters and others are reacting to Covid 19",https://www.forbes.com/sites/jonyounger/2020/03/21/pew-research-describes-how-freelancers-gigsters-and-others-see-the-coronavirus-threat/,https://thumbor.forbes.com/thumbor/fit-in/1200x0/filters%3Aformat%28jpg%29/https%3A%2F%2Fspecials-images.forbesimg.com%2Fimageserve%2F1081453884%2F0x0.jpg,2020-03-21T13:15:16Z,"Getty
According to Upwork, and reinforced by other digital talent platforms, over 50 million Americans have freelanced in the past year, working either as full time independent professionals, side-hustlers working occasional gigs, or full-time gigsters takin… [+5078 chars]"
490,"{'id': None, 'name': 'Forbes.com'}","Dima Williams, Contributor, Dima Williams, Contributor http://www.forbes.com/sites/dimawilliams/",Homebuilders Face The Effects Of Coronavirus,"Homebuilders adopt technology to sell residences as foot traffic to model homes slows. Yet, the construction industry still faces headwinds, prompted by the coronavirus.",https://www.forbes.com/sites/dimawilliams/2020/03/21/homebuilders-face-the-effects-of-coronavirus/,https://thumbor.forbes.com/thumbor/fit-in/1200x0/filters%3Aformat%28jpg%29/https%3A%2F%2Fspecials-images.forbesimg.com%2Fimageserve%2F1148509106%2F0x0.jpg%3FcropX1%3D0%26cropX2%3D5000%26cropY1%3D158%26cropY2%3D2971,2020-03-21T14:39:06Z,"Homebuilders adopt technology to sell homes but face headwinds in construction.
Getty
As the country seems to cautiously lock down in order to stem the spread of the coronavirus, homebuilders are embracing what is now becoming the new normal for the wider r… [+7068 chars]"
491,"{'id': None, 'name': 'Forbes.com'}","Billy Bambrough, Contributor, Billy Bambrough, Contributor https://www.forbes.com/sites/billybambrough/",Blow To Bitcoin As Russia Moves To Effectively Ban Crypto,"As potential bitcoin buyers are weighing whether to jump back into the market, a senior Russian official has warned its delayed bill on digital assets will include a ban on issuing and selling cryptocurrencies...",https://www.forbes.com/sites/billybambrough/2020/03/21/blow-to-bitcoin-as-russia-moves-to-effectively-ban-crypto/,https://thumbor.forbes.com/thumbor/fit-in/1200x0/filters%3Aformat%28jpg%29/https%3A%2F%2Fspecials-images.forbesimg.com%2Fimageserve%2F1205323901%2F0x0.jpg,2020-03-21T15:22:23Z,"The bitcoin and cryptocurrency community is reeling from the sudden market downturn in the face of the coronavirus crisis, with bitcoin prices swinging wildly over recent days. 
Earlier this month, many cheered India's decision to permit banks in the country… [+3100 chars]"
492,"{'id': None, 'name': 'Forbes.com'}","Will Jeakle, Contributor, Will Jeakle, Contributor https://www.forbes.com/sites/williamjeakle/",Why Apple Is Launching New iPad Pros In The Wake Of An Economic Downturn,"The fact that Apple is continuing to move forward with its release schedule is a very good thing, and within a long tradition of the company meeting financial challenges in the market with innovation.",https://www.forbes.com/sites/williamjeakle/2020/03/21/apples-new-ipad-pro/,https://thumbor.forbes.com/thumbor/fit-in/1200x0/filters%3Aformat%28jpg%29/https%3A%2F%2Fspecials-images.forbesimg.com%2Fimageserve%2F5e765619d8e1ae0007b71f93%2F0x0.jpg,2020-03-21T18:52:33Z,"Apple's new iPad Pro and Magic Keyboard
Apple
Though the United States is deep within the midst of the worst of the coronavirus pandemic with shutdowns throughout the country, overrun emergency rooms, and government relief checks being prepared, Apple just … [+3952 chars]"
493,"{'id': None, 'name': 'Forbes.com'}","Kyle Roderick, Contributor, Kyle Roderick, Contributor https://www.forbes.com/sites/kyleroderick/","How Buying Ethically Sourced, Handmade Jewelry Helps Sustain The Human Family: An Online Guide",Here's an expert guide to buying sustainably produced and ethically fabricated luxury jewelry online during this unprecedented time of social distancing.,https://www.forbes.com/sites/kyleroderick/2020/03/20/how-buying-ethically-sourced-handmade-jewelry-helps-sustain-the-human-family-an-online-guide/,https://thumbor.forbes.com/thumbor/fit-in/1200x0/filters%3Aformat%28jpg%29/https%3A%2F%2Fspecials-images.forbesimg.com%2Fimageserve%2F5e743ef810380d0006bdacf6%2F0x0.jpg,2020-03-21T01:13:03Z,"As designer/maker Yasmina Benazzou, founder of New York-based fine jewelry brand Haute Victoire ... [+] explains, ""At this point in time, it is important to keep purchasing whatever jewelry we can afford, as so many working families around the world in develo… [+9059 chars]"
494,"{'id': None, 'name': 'Forbes.com'}","Becky Pokora, Contributor, Becky Pokora, Contributor",Flight Cancelled? Don’t Rush To Rebook Or Accept A Voucher,"Airline cancellations and travel restrictions are wreaking havoc on existing plans, but the first option to change your flight isn't always the best. Here's what to consider.",https://www.forbes.com/sites/advisor/2020/03/21/flight-cancelled-dont-rush-to-rebook-or-accept-a-voucher/,https://thumbor.forbes.com/thumbor/fit-in/1200x0/filters%3Aformat%28jpg%29/https%3A%2F%2Fspecials-images.forbesimg.com%2Fimageserve%2F1011442476%2F0x0.jpg,2020-03-21T11:00:00Z,"Every day, airlines continue to cancel flights, ground aircraft and change their flexibility waivers, so its no surprise that travelers cant keep up with constantly updated scenarios. Navigating these uncertain times is both stressful and complicated, especia… [+8505 chars]"
495,"{'id': 'the-washington-post', 'name': 'The Washington Post'}","Marc Fisher, Frances Stead Sellers, Scott Wilson",Stay home or carry on during the coronavirus outbreak? Americans want to sacrifice for others but can't agree on what's right. - The Washington Post,Stay home or carry on during the coronavirus outbreak? Americans want to sacrifice for others but can't agree on what's right. The Washington Post,https://www.washingtonpost.com/nation/2020/03/21/coronavirus-sacrifice-america/,https://www.washingtonpost.com/resizer/IFmrBdyV3twOC5o3bwIsQfWJcFE=/1484x0/arc-anglerfish-washpost-prod-washpost.s3.amazonaws.com/public/ISALJJA5URHQRJECSGDEYW67YA.jpg,2020-03-21T21:43:08Z,"At a still-busy lunch spot in Boca Raton, Fla., two groups of older folks argued across their tables: on one side, a group of liberal Jewish anti-Trump transplants from New York; on the other, a bunch of Italian conservatives who admire the president. They di… [+15013 chars]"
496,"{'id': None, 'name': 'Bbc.com'}",https://www.facebook.com/bbcnews,Coronavirus: What could the West learn from Asia? - BBC News,"Coronavirus: What could the West learn from Asia? BBC News In coronavirus outbreak, Americans say Asia is now safer Los Angeles Times Hong Kong reports its largest jump in coronavirus cases | TheHill The Hill Hong Kong activates only a third of virus quaranti…",https://www.bbc.com/news/world-asia-51970379,https://ichef.bbci.co.uk/news/1024/branded_news/15D20/production/_111367398_mediaitem111367397.jpg,2020-03-21T00:31:35Z,"Image copyrightAFPImage caption
 Some Asian countries have useful lessons for the West - as well as a preview of what challenges could follow
The number of coronavirus cases in the West is skyrocketing, and countries have announced drastic measures, includi… [+11718 chars]"
497,"{'id': 'the-wall-street-journal', 'name': 'The Wall Street Journal'}",Laura Saunders,"Tax Day Is Now July 15: What to Know About Filing, Payment and IRAs - The Wall Street Journal","Tax Day Is Now July 15: What to Know About Filing, Payment and IRAs The Wall Street Journal Income Tax Deadline Moved to July 15, 2020 CPAPracticeAdvisor.com The federal tax deadline is now July 15. Here are 3 reasons you should probably still do your taxes a…",https://www.wsj.com/articles/tax-day-is-now-july-15-what-to-know-about-filing-payment-and-iras-11584792001,https://images.wsj.net/im-167116/social,2020-03-21T13:48:00Z,The Internal Revenue Service has extended the deadline for filing individual tax returns for 2019 to July 15 from April 15 in response to the coronavirus pandemic. The change came just two days after the agency extended the tax-payment deadline to July 15.  M… [+4960 chars]
498,"{'id': None, 'name': 'Forbes.com'}","Ken Roberts, Contributor, Ken Roberts, Contributor https://www.forbes.com/sites/kenroberts/","Export-Import Trade Loss In 2020 Could Approach $1 Trillion, If History Provides Guidance","U.S. trade would decline almost $1 trillion in 2019 if it falls at the same rate it did in 2009, when the world economy was reeling from the crisis that originated with the U. S. mortgage market.",https://www.forbes.com/sites/kenroberts/2020/03/21/export-import-trade-loss-in-2020-could-approach-1-trillion-if-history-provides-guidance/,https://thumbor.forbes.com/thumbor/fit-in/1200x0/filters%3Aformat%28jpg%29/https%3A%2F%2Fspecials-images.forbesimg.com%2Fimageserve%2F1213714151%2F0x0.jpg,2020-03-21T09:12:24Z,"Flanked by members of the Coronavirus Task Force, President Trump speaks during a briefing from the ... [+] White House on Friday on the latest developments of the coronavirus outbreak.
Getty Images
U.S. trade would decline almost $1 trillion in 2019 if it … [+4419 chars]"
499,"{'id': None, 'name': 'Forbes.com'}","Laurence Kotlikoff, Contributor, Laurence Kotlikoff, Contributor https://www.forbes.com/sites/kotlikoff/",A Coronavirus End Game That Avoids A Depression,President Trump and his administration spent two months ignoring a potential health Armageddon. Our governors need to announce a national health and economic rescue plan to tell the president and congress what to do and how to do it.,https://www.forbes.com/sites/kotlikoff/2020/03/21/a-coronavirus-end-game-that-avoids-a-depression/,https://thumbor.forbes.com/thumbor/fit-in/1200x0/filters%3Aformat%28jpg%29/https%3A%2F%2Fspecials-images.forbesimg.com%2Fimageserve%2F911006604%2F0x0.jpg,2020-03-21T18:51:29Z,"Getty Images
President Trump and his administration spent two months ignoring a potential health Armageddon. Our governors need to announce a national health and economic rescue plan to tell the president and congress what to do and how to do it.
Short of t… [+7373 chars]"
500,"{'id': None, 'name': 'Lifehacker.com'}","Lisa Rowan on Two Cents, shared by Lisa Rowan to Lifehacker",Beware of Scammers While You Wait for Your Coronavirus Stimulus Check,"The coronavirus outbreak has made the U.S. economy so topsy-turvy that the president has been working with Congress to issue relief checks to many of us. We’ll share the details of that program as soon as they’re official, but in the meantime, make sure you d…",https://twocents.lifehacker.com/beware-of-scammers-while-you-wait-for-your-coronavirus-1842414465,"https://i.kinja-img.com/gawker-media/image/upload/c_fill,f_auto,fl_progressive,g_center,h_675,pg_1,q_80,w_1200/bdww4istnuwlf9k5md8x.jpg",2020-03-20T17:00:00Z,"The coronavirus outbreak has made the U.S. economy so topsy-turvy that the president has been working with Congress to issue relief checks to many of us. Well share the details of that program as soon as theyre official, but in the meantime, make sure you don… [+1217 chars]"
501,"{'id': None, 'name': 'Gizmodo.com'}","Dharna Noor on Earther, shared by Andrew Couts to Gizmodo",The U.S. Should Stop Water Shutoffs During the Covid-19 Pandemic—and Forever,"There’s very little clarity about the current pandemic—how long it will last, when a vaccine could arrive—but medical experts all seem to agree that one of the few things we can do to significantly stop the spread of covid-19 is washing our hands frequently. …",https://earther.gizmodo.com/the-u-s-should-stop-water-shutoffs-during-the-covid-19-1842426252,"https://i.kinja-img.com/gawker-media/image/upload/c_fill,f_auto,fl_progressive,g_center,h_675,pg_1,q_80,w_1200/rxjjzd2bduw8stk9rkfi.jpg",2020-03-20T16:37:00Z,"Theres very little clarity about the current pandemichow long it will last, when a vaccine could arrivebut medical experts all seem to agree that one of the few things we can do to significantly stop the spread of covid-19 is washing our hands frequently. Ive… [+6766 chars]"
502,"{'id': 'bbc-news', 'name': 'BBC News'}",https://www.facebook.com/bbcnews,Coronavirus: US Senators face calls to resign over ‘insider trading’,Two US senators reportedly sold millions of dollars in stocks while downplaying the virus' threat.,https://www.bbc.co.uk/news/world-us-canada-51976484,https://ichef.bbci.co.uk/news/1024/branded_news/3D50/production/_111369651_senatorscollage.jpg,2020-03-20T12:43:30Z,"Image copyrightGetty ImagesImage caption
 Richard Burr is chairman of the Senate Intelligence Committee while Kelly Loeffler sits on the Senate Health Committee
Two US Republican Senators are facing calls to resign over allegations they used insider knowled… [+3064 chars]"
503,"{'id': 'cnn', 'name': 'CNN'}","Dan Merica, CNN",Andrew Yang's non-profit to spend more than $1 million to aid families impacted by virus,"Andrew Yang's new non-profit will spend more than $1 million helping working families impacted by the spread of the coronavirus in the New York area and across the country, the group announced on Friday.",https://www.cnn.com/2020/03/20/politics/andrew-yang-nonprofit-coronavirus/index.html,https://cdn.cnn.com/cnnnext/dam/assets/200310214637-andrew-yang-endorses-biden-screengrab-super-tease.jpg,2020-03-20T10:50:38Z,"(CNN)Andrew Yang's new non-profit will spend more than $1 million helping working families impacted by the spread of the coronavirus in the New York area and across the country, the group announced on Friday.
Humanity Forward, the organization Yang founded a… [+4061 chars]"
504,"{'id': 'bbc-news', 'name': 'BBC News'}",https://www.facebook.com/bbcnews,Is Iran covering up its outbreak?,Iran has seen one of the worst coronavirus outbreaks but the true scale may be being downplayed.,https://www.bbc.co.uk/news/world-middle-east-51930856,https://ichef.bbci.co.uk/news/1024/branded_news/C1AF/production/_111338594_iran-corona---liight-green.png,2020-03-20T09:54:58Z,"Iran is facing one of the largest coronavirus outbreaks in the world. Today, as families celebrate Persian New Year, Nowruz, there is concern the true scale of the virus is being downplayed by the government and could rapidly get much worse. 
Mohammad has be… [+13474 chars]"
505,"{'id': 'reuters', 'name': 'Reuters'}",Lisandra Paraguassu,Bolsonaro calls June critical month for coronavirus in Brazil,"Brazilian President Jair Bolsonaro said on Friday that June would likely be the most critical month for the coronavirus outbreak in the country, as he criticized state governors for taking extreme measures that were slowing the economy.",https://www.reuters.com/article/us-health-coronavirus-brazil-idUSKBN2171T4,https://s4.reutersmedia.net/resources_v2/images/rcom-default.png,2020-03-20T14:33:34Z,"BRASILIA (Reuters) - Brazilian President Jair Bolsonaro said on Friday that June would likely be the most critical month for the coronavirus outbreak in the country, as he criticized state governors for taking extreme measures that were slowing the economy. … [+1521 chars]"
506,"{'id': 'reuters', 'name': 'Reuters'}",Arshad Mohammed,U.S. to Iran: Coronavirus won't save you from sanctions,The United States sent Iran a blunt message this week: the spread of the coronavirus will not save it from U.S. sanctions that are choking off its oil revenues and isolating its economy.,https://www.reuters.com/article/us-health-coronavirus-iran-usa-idUSKBN21712L,https://s3.reutersmedia.net/resources/r/?m=02&d=20200320&t=2&i=1505777181&w=1200&r=LYNXMPEG2J0NP,2020-03-20T09:25:46Z,"WASHINGTON/DUBAI (Reuters) - The United States sent Iran a blunt message this week: the spread of the coronavirus will not save it from U.S. sanctions that are choking off its oil revenues and isolating its economy. 
Iran is the Middle Eastern nation worst h… [+4003 chars]"
507,"{'id': 'reuters', 'name': 'Reuters'}",David Lawder,This is no 2008: Mnuchin borrows from Paulson's economic crisis playbook,"U.S. Treasury Secretary Steven Mnuchin has stepped into the breach as the Trump administration's point man to rescue the economy from coronavirus devastation, taking on the role his former Goldman Sachs boss, Hank Paulson, played over a decade ago.",https://www.reuters.com/article/us-health-coronavirus-mnuchin-idUSKBN217315,https://s2.reutersmedia.net/resources/r/?m=02&d=20200320&t=2&i=1505973751&w=1200&r=LYNXMPEG2J1YC,2020-03-20T18:34:50Z,"WASHINGTON (Reuters) - U.S. Treasury Secretary Steven Mnuchin has stepped into the breach as the Trump administration’s point man to rescue the economy from coronavirus devastation, taking on the role his former Goldman Sachs boss, Hank Paulson, played over a… [+6454 chars]"
508,"{'id': 'reuters', 'name': 'Reuters'}",Reuters Editorial,'Buy as much as possible' - Taiwan sees boon to panic buying,"People in Taiwan were told to buy as much as possible during the coronavirus outbreak, as the island's premier struck a distinctly different approach to panic buying by advising them there was plenty to go around and it would support the economy.",https://www.reuters.com/article/us-healthcare-coronavirus-taiwan-premier-idUSKBN2170CF,https://s2.reutersmedia.net/resources/r/?m=02&d=20200320&t=2&i=1505668218&w=1200&r=LYNXMPEG2J09I,2020-03-20T03:27:37Z,"TAIPEI (Reuters) - People in Taiwan were told to buy as much as possible during the coronavirus outbreak, as the island’s premier struck a distinctly different approach to panic buying by advising them there was plenty to go around and it would support the ec… [+1996 chars]"
509,"{'id': 'reuters', 'name': 'Reuters'}",Dan Whitcomb,Californians ordered to stay home; New York pleas for urgent help to fight coronavirus,Nearly 40 million Californians have been ordered to stay at home as part of efforts to slow the spread of the coronavirus and New York's mayor on Friday renewed his pleas for U.S. President Donald Trump to mobilize the military for additional medical personne…,https://www.reuters.com/article/us-health-coronavirus-usa-idUSKBN21729V,https://s3.reutersmedia.net/resources/r/?m=02&d=20200320&t=2&i=1505892943&w=1200&r=LYNXMPEG2J1EK,2020-03-20T14:44:36Z,LOS ANGELES/NEW YORK (Reuters) - Nearly 40 million Californians have been ordered to stay at home as part of efforts to slow the spread of the coronavirus and New York’s mayor on Friday renewed his pleas for U.S. President Donald Trump to mobilize the militar… [+4581 chars]
510,"{'id': None, 'name': 'Cnet.com'}",Jackson Ryan,"Coronavirus updates: Illinois and California on lockdown, US Tax Day pushed back - CNET",Plus: The deaths in Italy surpass those in China.,https://www.cnet.com/news/coronavirus-updates-illinois-and-california-on-lockdown-us-tax-day-pushed-back/,https://cnet3.cbsistatic.com/img/iobfVlsYRwJt_vlp0AnD8dsmu4Y=/756x567/2020/03/18/5279c319-7e90-4283-8ea7-6f571b55df8e/gettyimages-1207608788.jpg,2020-03-20T20:49:00Z,"Health workers screen a patient for coronavirus on March 18 at a drive-through testing site in Arlington, Virginia.
Drew Angerer/Getty Images
For the most up-to-date news and information about the coronavirus pandemic, visit the WHO website.
COVID-19, the … [+78088 chars]"
