,source,author,title,description,url,urlToImage,publishedAt,content
237,"{'id': None, 'name': 'Bworldonline.com'}",bw_mark,Economic recovery possible by 2021 — Diokno - BusinessWorld Online,Economic recovery possible by 2021 — Diokno BusinessWorld Online,https://www.bworldonline.com/economic-recovery-possible-by-2021-diokno/,https://www.bworldonline.com/wp-content/uploads/2020/03/face-masks-supermarket-coronavirus-032320.jpg,2020-03-23T00:30:00Z,"By Luz Wendy T. NobleReporter
THE GOVERNMENT could miss its growth target this year after Luzon was locked down to contain a coronavirus disease 2019 (COVID-19) outbreak, even as growth is expected to pick up in the third quarter and recovery by 2021, accord… [+4619 chars]"
238,"{'id': None, 'name': 'Marketwatch.com'}",Associated Press,"Asian markets fall, led by plunge from Australian stocks - MarketWatch",Sydney’s ASX/S&P 200 drops about 8%; only Nikkei manages to tread water,http://www.marketwatch.com/story/asian-markets-fall-led-by-plunge-from-australian-stocks-2020-03-22,https://s.marketwatch.com/public/resources/images/MW-IC802_sydney_ZG_20200322222245.jpg,2020-03-23T03:06:45Z,"Australias share benchmark initially plunged 8.5% on Monday as work on more stimulus for the U.S. economy hit snags in the U.S. Senate. Sydneys S&amp;P/ASX 200
 XJO, 
 -5.72%
was trading 7.8% lower after plunging sharply just after the open. South Koreas K… [+2319 chars]"
239,"{'id': None, 'name': 'Yahoo.com'}",Susan NJANJI,South Africa announces lockdown as coronavirus spreads,"South Africa on Monday announced a three-week lockdown with soldiers patrolling the streets to ensure compliance as more countries in the continent reported coronavirus fatalities and the disease spread. President Cyril Ramaphosa said the government had ""deci…",https://news.yahoo.com/dr-congo-city-locks-down-more-african-nations-144607137.html,https://s.yimg.com/ny/api/res/1.2/Mt8YZZAf84zNIoD3pNdFOg--/YXBwaWQ9aGlnaGxhbmRlcjt3PTEyODA7aD04NTMuMzMzMzMzMzMzMzMzNA--/https://s.yimg.com/uu/api/res/1.2/_KadAgOjmHqzutzreNPidw--~B/aD01MTI7dz03Njg7c209MTthcHBpZD15dGFjaHlvbg--/http://media.zenfs.com/en_us/News/afp.com/9b26148f561d99cf1d4a44a17b189b71117cc5b4.jpg,2020-03-23T19:49:03Z,"Pretoria (AFP) - South Africa on Monday announced a three-week lockdown with soldiers patrolling the streets to ensure compliance as more countries in the continent reported coronavirus fatalities and the disease spread.
President Cyril Ramaphosa said the go… [+4473 chars]"
240,"{'id': None, 'name': 'Yahoo.com'}",Catherine Garcia,Trump declares the United States will 'soon be open for business',"President Trump on Monday evening said while the COVID-19 coronavirus pandemic is ""going to be bad,"" his administration is ""trying to make it much less bad"" and the United States ""cannot let the cure be worse than the problem itself.""Businesses deemed non-ess…",https://news.yahoo.com/trump-declares-united-states-soon-231400591.html,https://s.yimg.com/ny/api/res/1.2/woAXvchLG24h0Zo.Omtvzg--/YXBwaWQ9aGlnaGxhbmRlcjt3PTEyODA7aD04NTMuMzMzMzMzMzMzMzMzNA--/https://s.yimg.com/uu/api/res/1.2/vorAnJQrA80yXjvzlzKZXQ--~B/aD01NjA7dz04NDA7c209MTthcHBpZD15dGFjaHlvbg--/https://media.zenfs.com/en/the_week_574/bfbcadb95814936b2a8a1d506f361ab4,2020-03-23T23:14:00Z,"President Trump on Monday evening said while the COVID-19 coronavirus pandemic is ""going to be bad,"" his administration is ""trying to make it much less bad"" and the United States ""cannot let the cure be worse than the problem itself.""
Businesses deemed non-e… [+1024 chars]"
241,"{'id': None, 'name': 'Yahoo.com'}",The Independent,'He understands': Trump sidesteps whether Fauci agrees on new timetable to end quarantine in three weeks,"Donald Trump says the top health official leading the administration's coronavirus response ""understands"" the president's demands to end the effective US shutdown.Asked if Dr Anthony Fauci agrees with him, the president said: ""He doesn't not agree with me.""",https://news.yahoo.com/understands-trump-sidesteps-whether-fauci-195449143.html,https://s.yimg.com/ny/api/res/1.2/9Sm0jLgqC.tRvWEVZozMOg--/YXBwaWQ9aGlnaGxhbmRlcjt3PTEwNTI7aD03OTA-/https://s.yimg.com/uu/api/res/1.2/kmV98lk.T15Lm0qmdsslqA--~B/aD0zOTU7dz01MjY7c209MTthcHBpZD15dGFjaHlvbg--/https://media.zenfs.com/en/the_independent_635/73d8aebb6e8eb62fbd58bdb39ea760cc,2020-03-23T19:54:00Z,"Donald Trump says the top health official leading the administration's coronavirus response ""understands"" the president's demands to end the effective US shutdown.
Asked if Dr Anthony Fauci agrees with him, the president said: ""He doesn't not agree with me.""… [+1523 chars]"
242,"{'id': None, 'name': 'Yahoo.com'}",insider@insider.com (Eliza Relman),"Sen. Lindsey Graham said he's listening to Fauci and other coronavirus experts, not 'political punditry' in a veiled jab at President Trump","""I'm making my decisions based on healthcare professionals like Dr. Fauci and others, not political punditry,"" Graham tweeted.",https://news.yahoo.com/sen-lindsey-graham-said-hes-180504402.html,https://s.yimg.com/ny/api/res/1.2/5wCzH.qtp8BY2LmQUtOmfg--/YXBwaWQ9aGlnaGxhbmRlcjt3PTEyODA7aD05NjA-/https://s.yimg.com/uu/api/res/1.2/XI77xXC7lu9Pzo9Ir8WdgA--~B/aD0xODk3O3c9MjUyOTtzbT0xO2FwcGlkPXl0YWNoeW9u/https://media.zenfs.com/EN/business_insider_articles_888/64eba8fe87a9aeb86df5d06c5d2e00ba,2020-03-23T18:05:04Z,"Donald Trump speaks as Senator Lindsey Graham looks on.
Getty
<ul><li>Republican Sen. Lindsey Graham pushed back on President Donald Trump after the president suggested in a series of tweets on Monday that he'll scale back social distancing to boost the eco… [+4126 chars]"
243,"{'id': None, 'name': 'Yahoo.com'}",Reuters,Pence says U.S. coronavirus guidance to be re-evaluated after 15-day period ends,"U.S. Vice President Mike Pence, who is leading a U.S. task force to address the coronavirus outbreak, said on Monday the Trump administration would re-evaluate its guidance after the current 15-day guidance period ends. ""At the end of this 15 days, we're goin…",https://news.yahoo.com/pence-says-u-coronavirus-guidance-200046551.html,https://s.yimg.com/ny/api/res/1.2/WlXFv1ryoMXiyYc.S8D0Fg--/YXBwaWQ9aGlnaGxhbmRlcjt3PTEyODA7aD04NTIuOA--/https://s.yimg.com/uu/api/res/1.2/SCpKcm2ANcO_b.ole4.JPQ--~B/aD01MzM7dz04MDA7c209MTthcHBpZD15dGFjaHlvbg--/https://media.zenfs.com/en-US/reuters.com/7a1c7e9250fffcba2a9807f3fc83c9c3,2020-03-23T20:00:46Z,"WASHINGTON (Reuters) - U.S. Vice President Mike Pence, who is leading a U.S. task force to address the coronavirus outbreak, said on Monday the Trump administration would re-evaluate its guidance after the current 15-day guidance period ends.
""At the end of … [+581 chars]"
244,"{'id': None, 'name': 'Yahoo.com'}",ROB GILLIES,Ontario and Quebec to close all non-essential businesses,Canada's most populous province said Monday that non-essential businesses must close for at least 14 days starting at 11:59 p.m. Tuesday in efforts to stem the new coronavirus pandemic. Ontario Premier Doug Ford said he will release the list of businesses tha…,https://news.yahoo.com/ontario-close-non-essential-businesses-180131705.html,https://s.yimg.com/ny/api/res/1.2/VdCiRdpzh0u.Va3GX6QhzQ--/YXBwaWQ9aGlnaGxhbmRlcjt3PTEyODA7aD04NTMuMzMzMzMzMzMzMzMzNA--/https://s.yimg.com/uu/api/res/1.2/_54wxnTcPkyzUNCg.JoOlg--~B/aD00MTcwO3c9NjI1NTtzbT0xO2FwcGlkPXl0YWNoeW9u/https://media.zenfs.com/en/ap.org/11f2669b0ac861188487d5d02abb7a57,2020-03-23T18:01:31Z,"TORONTO (AP) Canada's most populous province said Monday that non-essential businesses must close for at least 14 days starting at 11:59 p.m. Tuesday in efforts to stem the new coronavirus pandemic.
Ontario Premier Doug Ford said he will release the list of … [+2667 chars]"
245,"{'id': None, 'name': 'Yahoo.com'}",Petra Cahill,Coronavirus: Massive stimulus bill stalls in Senate as Trump activates National Guard,"""This week, it's going to get bad,"" the U.S. Surgeon General Dr. Jerome Adams warned on the ""TODAY"" Show Monday.",https://news.yahoo.com/coronavirus-massive-stimulus-bill-stalls-121319082.html,https://s.yimg.com/ny/api/res/1.2/SxUQpLnV7CHxL6y1eJalyg--/YXBwaWQ9aGlnaGxhbmRlcjt3PTEyODA7aD05NjA-/https://s.yimg.com/uu/api/res/1.2/NrGz3v1.OH14LsGEz9h_rQ--~B/aD0xODc1O3c9MjUwMDtzbT0xO2FwcGlkPXl0YWNoeW9u/https://media.zenfs.com/en-US/nbc_news_122/6e8ea262a0d816d8206361c9e07ae294,2020-03-23T12:13:00Z,"Good morning, NBC News readers.
A coronavirus stimulus bill failed in the Senate, Canada and Australia have pulled out of the Olympics and despite draconian measures to prevent the spread, COVID-19 cases continue to soar in Europe.
Here's what we're watchin… [+6170 chars]"
246,"{'id': None, 'name': 'Yahoo.com'}",Melissa Quinn,Senate again fails to advance coronavirus bill as deal remains elusive,A second attempt to move forward with the massive spending deal failed as Democrats demanded changes to the Republican bill.,https://news.yahoo.com/senate-set-vote-again-advancing-031336196.html,https://s.yimg.com/ny/api/res/1.2/zMzN.cLDyLxRhZkafzO0RQ--/YXBwaWQ9aGlnaGxhbmRlcjt3PTEyODA7aD04ODcuNDY2NjY2NjY2NjY2Nw--/https://s.yimg.com/uu/api/res/1.2/c_EGL3ECl1rAxG_7vRcyQA--~B/aD0zODA2O3c9NTQ5MjtzbT0xO2FwcGlkPXl0YWNoeW9u/https://media.zenfs.com/en/cbs_news_897/4a5ee0c30370398827976814d74bbe28,2020-03-23T06:34:52Z,"Washington The Senate on Monday failed for the second time to clear a key procedural hurdle to advance a massive legislative package designed to provide economic relief to American workers and industries battered by the coronavirus outbreak, as tensions boile… [+7094 chars]"
247,"{'id': None, 'name': 'Yahoo.com'}",ALEXANDRA JAFFE,"Ex-campaign staffer sues Bloomberg over layoffs, cites fraud","A former staffer for Mike Bloomberg's presidential campaign filed a class-action lawsuit Monday alleging the billionaire broke a promise to pay his thousands of campaign workers through November, regardless of whether his 2020 bid was successful. The lawsuit,…",https://news.yahoo.com/ex-campaign-staffer-sues-bloomberg-203527595.html,https://s.yimg.com/ny/api/res/1.2/p06YIe_AsZHijZF5soAT1Q--/YXBwaWQ9aGlnaGxhbmRlcjt3PTEyODA7aD04NTMuMzMzMzMzMzMzMzMzNA--/https://s.yimg.com/uu/api/res/1.2/YRtzVqO5oCBugFvv7uWbwA--~B/aD0yNDI4O3c9MzY0MjtzbT0xO2FwcGlkPXl0YWNoeW9u/https://media.zenfs.com/en/ap.org/8c89d017fa587748761bb02c714f101e,2020-03-23T20:35:27Z,"WASHINGTON (AP) A former staffer for Mike Bloomberg's presidential campaign filed a class-action lawsuit Monday alleging the billionaire broke a promise to pay his thousands of campaign workers through November, regardless of whether his 2020 bid was successf… [+3061 chars]"
248,"{'id': None, 'name': 'Yahoo.com'}",Laura Litvan and Laura Davison,Democrats Again Block Stimulus as Talks Proceed: Congress Update,(Bloomberg) -- Republicans and Democrats in Congress are negotiating with Treasury Secretary Steven Mnuchin Monday in an attempt to reach a compromise on Majority Leader Mitch McConnell’s bill worth as much as $2 trillion to help soften the economic blow from…,https://news.yahoo.com/senate-set-more-showdown-votes-100000837.html,https://s.yimg.com/ny/api/res/1.2/QO7p.PC3WyPY4mKB.fw03Q--/YXBwaWQ9aGlnaGxhbmRlcjt3PTEyODA7aD03MjA-/https://s.yimg.com/uu/api/res/1.2/8_QFXfpr.1xQz4WgWg57xA--~B/aD03MjA7dz0xMjgwO3NtPTE7YXBwaWQ9eXRhY2h5b24-/https://s.yimg.com/hd/cp-video-transcode/prod/2020-03/23/5e7814c5cbde7347962058ca/5e7814c5cbde7347962058cb_o_U_v2.jpg,2020-03-23T18:08:52Z,(Bloomberg) -- Republicans and Democrats in Congress are negotiating with Treasury Secretary Steven Mnuchin Monday in an attempt to reach a compromise on Majority Leader Mitch McConnells bill worth as much as $2 trillion to help soften the economic blow from … [+5627 chars]
249,"{'id': None, 'name': 'Yahoo.com'}","HOPE YEN, CALVIN WOODWARD and TOM KRISHER",AP FACT CHECK: Trump says he always knew virus was pandemic,"President Donald Trump is revising history as to how he described the dangers of the coronavirus as it swept across China and showed early signs in the U.S. “I’ve felt it was a pandemic long before it was called a pandemic,” Trump insisted last week, adopting…",https://news.yahoo.com/ap-fact-check-trump-says-050722798.html,https://s.yimg.com/ny/api/res/1.2/eEP1AS0CNGxoEZs.AeaxQg--/YXBwaWQ9aGlnaGxhbmRlcjt3PTEyODA7aD04NTMuMzMzMzMzMzMzMzMzNA--/https://s.yimg.com/uu/api/res/1.2/lxaJyqx0b1SWDAH8Z48hTA--~B/aD0yNjUwO3c9Mzk3NjtzbT0xO2FwcGlkPXl0YWNoeW9u/https://media.zenfs.com/en/ap.org/83359fe804e8a5df1639659e2e8a846c,2020-03-23T05:07:22Z,"WASHINGTON (AP) President Donald Trump is revising history as to how he described the dangers of the coronavirus as it swept across China and showed early signs in the U.S.
Ive felt it was a pandemic long before it was called a pandemic, Trump insisted last … [+9383 chars]"
250,"{'id': None, 'name': 'Yahoo.com'}",,There's No Way 267 Million People Had Zero Cases,"(Bloomberg Opinion) -- In a matter of weeks, the world’s fourth-most populous nation went from reporting zero coronavirus cases to having the highest death toll in Southeast Asia. Now its currency is tumbling, growth forecasts are buckling, the capital is und…",https://news.yahoo.com/theres-no-way-267-million-230016975.html,,2020-03-23T23:00:16Z,
251,"{'id': 'time', 'name': 'Time'}",TIME Staff,Time for Kids Launches Free Digital Library for Those Affected Globally by School Closures During the Coronavirus Pandemic,"Made possible by Google, AT&T, HP and PwC Charitable Foundation, the new TIME for Kids digital library will be available for free for the remainder of the school year (New York, NY, March 23, 2020) — TIME for Kids, the school-based publication that has provid…",https://time.com/5808059/time-for-kids-coronavirus-digital-library/,https://api.time.com/wp-content/uploads/2020/03/Hero_TFKCorona.jpg?quality=85&w=1200&h=628&crop=1,2020-03-23T11:00:37Z,"Made possible by Google, AT&amp;T, HP and PwC Charitable Foundation, the new TIME for Kids digital library will be available for free for the remainder of the school year
(New York, NY, March 23, 2020) — TIMEfor Kids, the school-based publication that has pr… [+6817 chars]"
252,"{'id': None, 'name': 'Huffpost.com'}",Ed Mazza,Intensive Care Specialist Does The Chilling Math On How Fast Coronavirus Spreads,Dr. Hugh Montgomery shows why this illness isn't like the flu at all.,https://www.huffpost.com/entry/coronavirus-spread-rate_n_5e78699ac5b63c3b64934b90,https://img.huffingtonpost.com/asset/5e786de02300003100c8b5cf.jpeg?cache=3RAH3pnnVH&ops=1200_630,2020-03-23T08:49:08Z,"Some politicians and media figures have attempted to dismiss coronavirus by comparing it to the flu based on some of the numbers they’ve seen. Earlier this month, even President Donald Trump complained that the flu was deadlier yet “nothing is shut down, life… [+359 chars]"
253,"{'id': None, 'name': 'Huffpost.com'}",Zach Carter,No Quarter For The Republican Corporate Bailout,Welfare for the rich will do nothing to assuage the coronavirus crash.,https://www.huffpost.com/entry/republican-senate-coronavirus-corporate-bailout_n_5e790f5fc5b63c3b64955988,https://img.huffingtonpost.com/asset/5e79139e2300003000c8b6a9.jpeg?cache=Wd4O6U50Q0&ops=1200_630,2020-03-23T20:44:24Z,"Over the next year, the United States will almost certainly go through a depression. Economists at Goldman Sachs currently expect the U.S. economy to shrink by an unprecedented 24% next quarter. They’re optimists compared to Morgan Stanley, which expects a 30… [+3638 chars]"
254,"{'id': None, 'name': 'Huffpost.com'}",AP,Coronavirus Rescue Talks Churn Late Into Night After Dems Reject GOP Bailout Bill,Democrats argued the rescue package was tilted toward corporations and did too little to help workers and health care providers.,https://www.huffpost.com/entry/coronavirus-talks-after-dems-reject-gop-bailout-bill_n_5e78b273c5b6f5b7c547ea4b,https://img.huffingtonpost.com/asset/5e78b3c62200005500b3a826.jpeg?cache=29z4pay3uh&ops=1778_1000,2020-03-23T13:16:23Z,"WASHINGTON (AP) Top-level negotiations between Congress and the White House churned late into the night over a now nearly $2 trillion economic rescue package, as the coronavirus crisis deepened, the nation shut down and the first U.S. senator tested positive … [+9178 chars]"
255,"{'id': None, 'name': 'Huffpost.com'}",Hayley Miller,GOP Senate Candidate Claims Coronavirus Likely ‘Created In A Lab’ By China,"The New Hampshire Republican said he was trying to be ""responsible"" about a theory that has been widely rejected by scientists.",https://www.huffpost.com/entry/donald-bolduc-coronavirus-china-conspiracy-theori_n_5e78b2f9c5b6f5b7c547eb52,https://img.huffingtonpost.com/asset/5e78ba5a2400003300cea1c4.jpeg?cache=xek61kul5i&ops=1778_1000,2020-03-23T20:14:47Z,"A Republican running for the U.S. Senate in New Hampshire has repeatedly claimed China likely created the novel coronavirus in a laboratory a theory widely rejected by scientists and also pushed by pro-Kremlin voices seeking to sow discord. 
Donald Bolduc, a… [+6223 chars]"
256,"{'id': None, 'name': 'Huffpost.com'}",Wudan Yan,"The View From Seattle, Which Is A Week Ahead Of The Rest Of Us On Coronavirus",Here’s how working families are coping with having to do it all.,https://www.huffpost.com/entry/working-from-home-kids-seattle-coronavirus_n_5e76a8f5c5b6f5b7c545969d,https://img.huffingtonpost.com/asset/5e78d69a2400003200cea1ea.jpeg?cache=6Zk2qlURoS&ops=1200_630,2020-03-23T16:12:18Z,"SEATTLE Michelle was home when her phone buzzed with an automated text message from the school district: All K-12 schools will be closed for the next six weeks. 
Michelle, a program manager working the heart of the nation’s novel coronavirus outbreak, had se… [+7495 chars]"
257,"{'id': None, 'name': 'Espn.com'}",Gabriele Marcotti,Soccer can figure out financial impact of coronavirus,Soccer's next challenge after coronavirus is figuring out how to handle the financial devastation but it can be done if all sides work together.,https://www.espn.com/soccer/blog-marcottis-musings/story/4077820/soccer-can-figure-out-coronavirus-financial-impact-plus-go-easy-on-neymar-for-going-home,https://a2.espncdn.com/combiner/i?img=%2Fphoto%2F2020%2F0323%2Fr682246_1296x729_16%2D9.jpg,2020-03-23T17:47:54Z,"With soccer's shutdown continuing due to the coronavirus outbreak, attention shifts to figuring out how and when it can return to normality. Gab Marcotti reacts to the main talking points in the latest Monday Musings.
Jump to: Football's financial crisis | I… [+11917 chars]"
258,"{'id': None, 'name': 'Slate.com'}",Mary Harris,Can Congress Save the Economy?,The Senate is at an impasse over a trillion dollar coronavirus rescue package.,https://slate.com/podcasts/what-next/2020/03/the-political-fight-to-save-americas-economy,https://compote.slate.com/images/fbebccfa-478f-45a4-964f-efe48bc9465c.jpeg,2020-03-23T09:00:01Z,"To understand where the country is right now in battling this pandemic you have to confront some pretty grim statistics. Roughly one in three Americans are under some kind of orders to stay at home. The number of confirmed COVID-19 cases surpassed 33,000. And… [+404 chars]"
259,"{'id': None, 'name': 'Slate.com'}",Susan Matthews,How Do We Know We Are Doing the Right Thing?,And how long can we keep this up?,https://slate.com/technology/2020/03/coronavirus-pandemic-avoiding-worst.html,https://compote.slate.com/images/bd6fa5de-b248-4b24-b94c-6bbeb431b81d.jpeg?width=780&height=520&rect=1560x1040&offset=0x0,2020-03-23T23:51:57Z,"How long can we keep this up?
<ol><li>
Abortion Care Is More Essential During a Pandemic, Not Less
 </li><li>
You Need Me to Have a Mask
 </li><li>
Were Not Going to Know How to Treat the Coronavirus for Some Time
 </li><li>
A Message From Italy: Its … [+11081 chars]"
260,"{'id': 'abc-news', 'name': 'ABC News'}",Libby Cathey,Coronavirus government response updates: Senate Democrats block stimulus bill,Here's how the government has been rolling out its response to the coronavirus and efforts to stem the tide as well as stimulate the economy which has taken a severe hit.,https://abcnews.go.com/Politics/coronavirus-government-response-updates-klobuchars-husband-tests-positive/story?id=69745713,https://s.abcnews.com/images/Health/trump-wh-briefing_hpMain_20200322-233917_16x9_992.jpg,2020-03-23T18:37:37Z,"The novel coronavirus pandemic is spreading around the globe and in the United States, reaching some 3,500 cases domestically and nearly 500 deaths.
The federal government has been rolling out its response to the virus and efforts to stem the tide as well as… [+10209 chars]"
261,"{'id': 'abc-news', 'name': 'ABC News'}",Catherine Thorbecke,Futures on US markets signal uptick after Fed announces further intervention,Futures on the Dow hit their limit down threshold overnight.,https://abcnews.go.com/Business/futures-us-markets-signal-uptick-fed-announces-intervention/story?id=69743706,https://s.abcnews.com/images/Business/coronavirus-stock-ap-er-200317_hpMain_16x9_992.jpg,2020-03-23T13:07:00Z,"Futures on U.S. financial markets reversed their free fall early Monday after the Federal Reserve signaled further intervention to help lessen the blow of the coronavirus pandemic on the economy.
The spike in premarket trading came after the Fed announced a … [+559 chars]"
262,"{'id': 'abc-news', 'name': 'ABC News'}",ABC News,"WATCH: Coronavirus daily update: March 23, 2020",The latest news and biggest developments to keep you informed about the deadly pandemic.,https://abcnews.go.com/Health/video/coronavirus-daily-update-march-23-2020-69755051,https://s.abcnews.com/images/Health/200323_vod_covid_daily_hpMain_16x9_992.jpg,2020-03-23T19:52:06Z,"<li>Now Playing: Staying sane with your spouse
</li><li>Now Playing: Staying fit at home
</li><li>Now Playing: Dr. Jen Ashton answers viewers' questions about coronavirus
</li><li>Now Playing: The new normal: Immunity boosting foods
</li><li>Now Playing: … [+1169 chars]"
263,"{'id': 'abc-news', 'name': 'ABC News'}",Ben Gittleson,Trump retweets messages supporting rollback of steps to mitigate coronavirus spread,The White House listed no events on President Donald Trump's public schedule Monday morning.,https://abcnews.go.com/Politics/trump-fires-off-tweets-us-tackles-coronavirus-including/story?id=69750361,https://s.abcnews.com/images/Politics/donald-trump-coronavirus-01-ss-jc-200323_hpMain_16x9_992.jpg,2020-03-23T18:37:34Z,"As the nation reeled from the novel coronavirus pandemic, President Donald Trump spent his Monday morning on Twitter, sharing 29 tweets and retweets that ranged from criticizing former Vice President Joe Biden to attacking The New York Times, and shared messa… [+2301 chars]"
264,"{'id': 'abc-news', 'name': 'ABC News'}",Dana Schaeffer,How novel coronavirus is impacting people around the US.,"In the last week, cases have spiked around the country. New York Governor, Andrew Cuomo announcing a 100% workforce reduction for all non-essential businesses statewide.",https://abcnews.go.com/US/coronavirus-impacting-people-us/story?id=69746160,https://s.abcnews.com/images/US/Beach-Closed-Coronavirus_hpMain_20200323-092203_16x9_992.jpg,2020-03-23T13:47:11Z,"In the last week, cases of coronavirus have spiked around the country causing New York Governor Andrew Cuomo to announce a 100% workforce reduction for all non-essential businesses statewide, while California Governor Gavin Newsom issued a stay-at-home order … [+3687 chars]"
265,"{'id': None, 'name': 'Fastcompany.com'}",Elizabeth Segran,How your business can help fight coronavirus: One brand’s playbook for pivoting to masks,The brand collaborated with a doctor to create a fabric mask with an insert for a HEPA filter. Ellen Bennett felt like she was flailing last week. The owner of Hedley & Bennett worried about how quickly the coronavirus was spreading and was concerned about ho…,https://www.fastcompany.com/90480732/this-high-end-apron-company-switched-to-manufacturing-masks-in-24-hours?partner=feedburner&utm_source=feedburner&utm_medium=feed&utm_campaign=Feed%3A+fastcompany%2Fheadlines+%28Fast+Company%29,"https://images.fastcompany.net/image/upload/w_1280,f_auto,q_auto,fl_lossy/wp-cms/uploads/2020/03/p-1-90480732-how-this-apron-brand-switched-to-manufacturing-masks-in-24-hours.jpg",2020-03-23T14:00:51Z,"Ellen Bennett felt like she was flailing last week. The owner of Hedley &amp; Bennett worried about how quickly the coronavirus was spreading and was concerned about how she was going to keep paying her 30 employees if the economy shut down. Then, on Friday, … [+6724 chars]"
266,"{'id': 'usa-today', 'name': 'USA Today'}","USA TODAY, Editors, USA TODAY","Coronavirus stimulus package, Olympics, stocks poised to extend losses: 5 things to know Monday","The Senate is to hold a procedural vote on a $1 trillion-plus coronavirus stimulus package, stocks poised to extend losses and more news you need to know Monday.",https://www.usatoday.com/story/news/2020/03/23/coronavirus-stimulus-tokyo-olympics-stocks-5-things-know-monday/2871591001/,"https://www.gannett-cdn.com/presto/2020/03/23/USAT/53c32529-7de9-4d0d-b6b7-b1b673116e7e-GTY_1213764516.JPG?crop=4415,2484,x0,y0&width=3200&height=1680&fit=bounds",2020-03-23T06:51:02Z,"Will lawmakers agree on an economic rescue package?
The Senate will hold a procedural vote Monday on a $1 trillion-plus GOP bill that would provide payments of $1,200 to most Americans amid the coronavirus pandemic. Negotiations over the massive economic pac… [+4377 chars]"
